{
  "info": {
    "archiveAttributes": {
      "name": "bank",
      "creationDate": "2016-06-28T14:35:05.618Z"
    },
    "archiveFormat": "bmpr",
    "archiveRevision": "56",
    "archiveRevisionUuid": "893B90D0-B0A4-9261-0A52-287304E76C5E",
    "schemaVersion": "2.0"
  },
  "mockups": [
    {
      "id": "ADC6E183-B52E-038A-1BBC-DAEDBAE75554",
      "attributes": {
        "name": "Banking Website",
        "kind": "Mockup",
        "trashed": false,
        "order": "2445915.87862848",
        "thumbnailID": "4B16F0EB-CAD0-5E34-0BD3-DAEDBAF4CAF6",
        "notes": "",
        "creationDate": "1970-01-01T00:00:00Z",
        "mimeType": "text/vnd.balsamiq.bmml",
        "importedFrom": "file:///Users/michael/Downloads/Banking Website.bmml"
      },
      "branchId": "Master",
      "measuredH": "600",
      "measuredW": "800",
      "mockupH": "600",
      "mockupW": "800",
      "version": "1.0",
      "controls": [
        {
          "id": "10",
          "typeID": "BreadCrumbs",
          "x": "30",
          "y": "83",
          "measuredW": "176",
          "measuredH": "24",
          "zOrder": "7",
          "properties": {
            "text": "All Accounts, Checking"
          }
        },
        {
          "id": "15",
          "typeID": "Label",
          "x": "538",
          "y": "117",
          "measuredW": "230",
          "measuredH": "32",
          "zOrder": "10",
          "properties": {
            "text": "{size:14}Available balance:{size} $4,217.48",
            "align": "right",
            "size": "24"
          }
        },
        {
          "id": "16",
          "typeID": "Button",
          "x": "671",
          "y": "217",
          "measuredW": "114",
          "measuredH": "27",
          "zOrder": "11",
          "properties": {
            "text": "Download",
            "icon": {
              "ID": "download",
              "size": "xsmall"
            }
          }
        },
        {
          "id": "2",
          "typeID": "DataGrid",
          "x": "30",
          "y": "257",
          "w": "739",
          "h": "319",
          "measuredW": "634",
          "measuredH": "322",
          "zOrder": "17",
          "properties": {
            "text": "Date v, Description, Type, Amount, Balance, Actions\n_processing_, _Balgreens_, _Debit_, _-$27.33_, _$4217.48_,  [View Details]\nSept 19, Bill's books, Debit, -$18.37, $4244.81,  [View Details]\nSept 17, Bank of The World, Withdrawal, -$80.00, $4263.18,  [View Details]\nSept 17, Check 465, Check, -$27.00, $4343.18,  [View Details] | [View Check]\nSept 16, Local 123, Debit, -$12.17, $4370.18,  [View Details]\nSept 15, Bank of The World, Deposit, $1711.68, $4382.35,  [View Details]\nSept 15, Monterey Market, Debit, -$43.60, $2670.67,  [View Details]\nSept 15, The Cheese Board, Debit, -$11.05, $2714.27,  [View Details]\nSept 14, BART, Debit, -$20.00, $2725.32,  [View Details]\nSept 13, Bank of The World, Withdrawal, -$80.00, $2745.32,  [View Details]\n{1L, 2L, 1L, 1R, 1R, 2L}",
            "selectedIndex": "0",
            "size": "14",
            "verticalScrollbar": "true"
          }
        },
        {
          "id": "23",
          "typeID": "SearchBox",
          "x": "474",
          "y": "170",
          "w": "222",
          "measuredW": "169",
          "measuredH": "28",
          "zOrder": "8",
          "properties": {
            "text": "search transactions"
          }
        },
        {
          "id": "24",
          "typeID": "Button",
          "x": "706",
          "y": "171",
          "measuredW": "75",
          "measuredH": "27",
          "zOrder": "9",
          "properties": {
            "text": "Search",
            "color": "2848996"
          }
        },
        {
          "id": "25",
          "typeID": "Button",
          "x": "595",
          "y": "217",
          "measuredW": "78",
          "measuredH": "27",
          "zOrder": "14",
          "properties": {
            "text": "Print",
            "icon": {
              "ID": "print",
              "size": "xsmall"
            }
          }
        },
        {
          "id": "26",
          "typeID": "Label",
          "x": "30",
          "y": "221",
          "measuredW": "450",
          "measuredH": "24",
          "zOrder": "15",
          "properties": {
            "text": "Transactions from September 1st to September 19th, 2013",
            "bold": "true"
          }
        },
        {
          "id": "27",
          "typeID": "Label",
          "x": "608",
          "y": "83",
          "measuredW": "161",
          "measuredH": "24",
          "zOrder": "16",
          "properties": {
            "text": "September 19th, 2013",
            "color": "6710886"
          }
        },
        {
          "id": "30",
          "typeID": "LinkBar",
          "x": "76",
          "y": "177",
          "measuredW": "283",
          "measuredH": "22",
          "zOrder": "12",
          "properties": {
            "text": "All, Current Month, Last Month, Custom",
            "selectedIndex": "1",
            "size": "14"
          }
        },
        {
          "id": "31",
          "typeID": "Label",
          "x": "30",
          "y": "174",
          "measuredW": "39",
          "measuredH": "22",
          "zOrder": "13",
          "properties": {
            "text": "Filter:",
            "bold": "true",
            "size": "14"
          }
        },
        {
          "id": "32",
          "typeID": "Canvas",
          "x": "0",
          "y": "0",
          "w": "800",
          "h": "600",
          "measuredW": "100",
          "measuredH": "70",
          "zOrder": "0",
          "properties": {
            "backgroundAlpha": "0",
            "borderStyle": "none",
            "color": "6710886"
          }
        },
        {
          "id": "4",
          "typeID": "Canvas",
          "x": "15",
          "y": "9",
          "w": "770",
          "h": "67",
          "measuredW": "100",
          "measuredH": "70",
          "zOrder": "1",
          "properties": {
            "borderStyle": "none",
            "color": "10066329"
          }
        },
        {
          "id": "5",
          "typeID": "IconLabel",
          "x": "30",
          "y": "18",
          "measuredW": "251",
          "measuredH": "48",
          "zOrder": "3",
          "properties": {
            "text": "Bank of The World",
            "color": "16777215",
            "icon": {
              "ID": "globe",
              "size": "large"
            },
            "labelPosition": "right",
            "size": "24"
          }
        },
        {
          "id": "6",
          "typeID": "LinkBar",
          "x": "554",
          "y": "18",
          "measuredW": "215",
          "measuredH": "24",
          "zOrder": "4",
          "properties": {
            "text": "My Account, Help, Log Out",
            "color": "16777215"
          }
        },
        {
          "id": "7",
          "typeID": "TabBar",
          "x": "15",
          "y": "52",
          "w": "769",
          "h": "535",
          "measuredW": "265",
          "measuredH": "100",
          "zOrder": "2",
          "properties": {
            "text": "Accounts, Bill Pay, Transfer",
            "color": "15658734",
            "selectedIndex": "0",
            "tabHPosition": "center"
          }
        },
        {
          "id": "8",
          "typeID": "Canvas",
          "x": "15",
          "y": "76",
          "w": "770",
          "h": "511",
          "measuredW": "100",
          "measuredH": "70",
          "zOrder": "5",
          "properties": {
            "borderStyle": "none",
            "color": "15658734"
          }
        },
        {
          "id": "9",
          "typeID": "SubTitle",
          "x": "30",
          "y": "122",
          "measuredW": "199",
          "measuredH": "28",
          "zOrder": "6",
          "properties": {
            "text": "Checking Account"
          }
        }
      ]
    },
    {
      "id": "ADC6E183-B52E-038A-1BBC-DAEDBAE75554",
      "attributes": {
        "name": "Banking Website",
        "kind": "Mockup",
        "trashed": false,
        "order": "2445915.87862848",
        "thumbnailID": "BA9EC520-EFFD-5CD9-B178-2850716C4262",
        "notes": "notes for alt",
        "creationDate": "1970-01-01T00:00:00Z",
        "mimeType": "text/vnd.balsamiq.bmml",
        "importedFrom": ""
      },
      "branchId": "2E28A7DC-63AF-CA57-4C22-2850716941C1",
      "measuredH": "600",
      "measuredW": "800",
      "mockupH": "600",
      "mockupW": "800",
      "version": "1.0",
      "controls": [
        {
          "id": "10",
          "typeID": "BreadCrumbs",
          "x": "30",
          "y": "83",
          "zOrder": "7",
          "properties": {
            "text": "All Accounts, Checking"
          }
        },
        {
          "id": "15",
          "typeID": "Label",
          "x": "538",
          "y": "117",
          "zOrder": "10",
          "properties": {
            "text": "{size:14}Available balance:{size} $4,217.48",
            "align": "right",
            "bold": "false",
            "size": "24"
          }
        },
        {
          "id": "16",
          "typeID": "Button",
          "x": "671",
          "y": "217",
          "zOrder": "11",
          "properties": {
            "text": "Download",
            "color": "16777215",
            "icon": {
              "name": "DownloadIcon",
              "size": "xsmall"
            }
          }
        },
        {
          "id": "2",
          "typeID": "DataGrid",
          "x": "30",
          "y": "257",
          "w": "739",
          "h": "319",
          "zOrder": "17",
          "properties": {